{
  "pointer_id": "inei-endes-2024-1629",
  "source": "inei-endes",
  "edition": "2024",
  "module": "1629",
  "filename": "968-Modulo1629.zip",
  "sha256": "1a76f981952668004660b346e7b0cd2cf4c41291a27a38e2e73046884e17c799",
  "size_bytes": 5184994,
  "retrieved_at": "2026-10-16T06:14:00+00:00",
  "origin_url": "https://proyectos.inei.gob.pe/iinei/srienaho/descarga/SPSS/968-Modulo1629.zip",
  "terms_url": "http://webinei.inei.gob.pe/anda_inei/index.php/catalog/817/accesspolicy",
  "freeze_level": "recipe-and-hash",
  "freeze_level_status": "confirmed",
  "license_note": "Politica de acceso de ENDES 2024 en el catalogo ANDA del INEI (consultada 2026-10-16): cita obligatoria de la fuente, prohibida la comercializacion y prohibida la copia a soportes electronicos de acceso multiusuario sin consentimiento escrito del INEI. Por ello el nivel es recipe-and-hash (nivel 3, confirmado por decision del usuario el 2026-10-16): el registry publica receta y sha256, los bytes viven solo en el remote DVC privado (R2) y se publican unicamente salidas transformadas con cita. Ascenso a restricted-mirror-doi (nivel 2) solo con consentimiento escrito del INEI. Fuentes: docs/research/05-licencias-derecho-preservacion.md y 06-criterios-de-congelamiento.md.",
  "locations": [
    {
      "kind": "origin",
      "uri": "https://proyectos.inei.gob.pe/iinei/srienaho/descarga/SPSS/968-Modulo1629.zip"
    },
    {
      "kind": "dvc-remote",
      "uri": "dvc+r2://files/md5/ce/a17cdb6f8c4b0d850a0b43622d0b3f",
      "verified_at": "2026-10-16T06:14:00+00:00"
    }
  ],
  "dvc_file": "raw/inei-endes/2024/1629/968-Modulo1629.zip.dvc",
  "dvc_md5": "cea17cdb6f8c4b0d850a0b43622d0b3f"
}
